{
  "schema_version": "InstallationLockV1",
  "lock_id": "acme.lock.7",
  "generated_at": "2026-08-11T12:03:00Z",
  "installation": {
    "installation_id": "acme.platform",
    "revision": 7,
    "sha256": "3333333333333333333333333333333333333333333333333333333333333333"
  },
  "registry_snapshot": {
    "registry_id": "intdata.registry",
    "version": "2026.08.11",
    "sha256": "4444444444444444444444444444444444444444444444444444444444444444"
  },
  "resolver_version": "1.0.0",
  "solver_policy_version": "1.0.0",
  "policy_input_sha256": "5555555555555555555555555555555555555555555555555555555555555555",
  "bootstrap_root_set_digest": "97ef2cc9b43908a6be6e7b3c91680f75f9e4cbec15828056bec6f024d966e531",
  "bridge_oauth_registration_approval_issuer": "https://bridge.intdata.pro/oauth",
  "bridge_oauth_registration_approval_audience": "https://api.intdata.pro/internal/platform-identity/v1/bridge/software-statements",
  "resolved_modules": [
    {
      "module_id": "bridge.core",
      "version": "1.0.0",
      "manifest_sha256": "ffffffffffffffffffffffffffffffffffffffffffffffffffffffffffffffff",
      "release_manifest_sha256": "1111111111111111111111111111111111111111111111111111111111111111",
      "signature_envelope_sha256": "2222222222222222222222222222222222222222222222222222222222222222"
    }
  ],
  "capability_bindings": [
    {
      "capability_id": "bridge.oauth",
      "provider_module_id": "bridge.core",
      "provider_version": "1.0.0"
    }
  ],
  "artifact_bindings": [
    {
      "artifact_id": "bridge.package",
      "module_id": "bridge.core",
      "sha256": "cccccccccccccccccccccccccccccccccccccccccccccccccccccccccccccccc",
      "size_bytes": "1024",
      "locations": ["https://artifacts.example/bridge-core.tar.gz"]
    }
  ],
  "route_bindings": [
    {
      "route_id": "bridge.mcp",
      "module_id": "bridge.core",
      "origin": "https://bridge.intdata.pro",
      "path": "/mcp",
      "runtime_unit_id": "bridge.server"
    }
  ],
  "migration_bindings": [],
  "mcp_bindings": [
    {
      "capability_id": "bridge.oauth",
      "resource_uri": "https://bridge.intdata.pro/mcp",
      "audience": "https://bridge.intdata.pro/mcp",
      "runtime_unit_id": "bridge.server"
    }
  ],
  "runtime_bindings": [
    {
      "runtime_unit_id": "bridge.server",
      "module_id": "bridge.core",
      "artifact_sha256": "cccccccccccccccccccccccccccccccccccccccccccccccccccccccccccccccc",
      "configuration_custody_refs": ["vault.database.url"]
    }
  ]
}
